{
  "skill": "relationship-graph",
  "version": "0.1.0",
  "status": "success",
  "mode": "summarize_network",
  "run_directory": null,
  "root_person": null,
  "target_person": null,
  "related_people": [],
  "connection_path": [],
  "graph": {
    "nodes": [
      { "person_name": "剑锋", "person_ref": "person_jianfeng", "profile_tier": "key", "confidence": "high", "kind": "profile" },
      { "person_name": "雁然", "person_ref": "person_yanran", "profile_tier": "key", "confidence": "high", "kind": "profile" },
      { "person_name": "贵彬", "person_ref": "person_gui_bin", "profile_tier": "active", "confidence": "low", "kind": "profile" }
    ],
    "edges": [
      {
        "source": "person_jianfeng",
        "target": "person_yanran",
        "relation_score": 106,
        "relation_type": "same_context_and_mentioned",
        "relation_reasons": ["共享资料源 4 个", "档案内容中互相提及"]
      },
      {
        "source": "person_jianfeng",
        "target": "person_gui_bin",
        "relation_score": 7,
        "relation_type": "same_source_context",
        "relation_reasons": ["共享资料源 1 个"]
      }
    ]
  },
  "network_summary": {
    "profile_count": 3,
    "edge_count": 2,
    "top_connectors": ["剑锋", "雁然"],
    "isolated_people": [],
    "graph_node_count": 3
  },
  "influence_notes": [
    "当前网络最强的连接中心是：剑锋 / 雁然。"
  ],
  "review_bundle": {
    "required": true,
    "pending_edge_count": 1,
    "edge_candidates": [
      {
        "source_person_name": "剑锋",
        "source_person_ref": "person_jianfeng",
        "target_person_name": "贵彬",
        "target_person_ref": "person_gui_bin",
        "relation_type": "same_source_context",
        "relation_score": 7,
        "reason": "这条边主要来自共享资料源，还缺少更直接的互相提及或稳定协作证据。 关系分数偏低，说明证据量有限。 至少一侧人物档案置信度偏低，关系判断可能会被上游实体识别误差带偏。",
        "suggested_action": "check_entity_alignment",
        "review_priority": 6
      }
    ],
    "review_notes": [
      "以下关系边证据偏弱、主要基于共现，或节点档案置信度偏低，建议用户确认后再把它当成稳定关系。"
    ]
  },
  "render_artifacts": {
    "format": "mermaid",
    "graph_kind": "summarize_network",
    "node_count": 3,
    "edge_count": 2,
    "mermaid": "flowchart LR\n  person_jianfeng[\"剑锋<br/>key / high\"]\n  person_yanran[\"雁然<br/>key / high\"]\n  person_gui_bin[\"贵彬<br/>active / low\"]\n  person_jianfeng -- \"106 · same_context_and_mentioned\" --> person_yanran\n  person_jianfeng -. \"7 · same_source_context ?\" .-> person_gui_bin\n  class person_jianfeng defaultNode\n  class person_yanran defaultNode\n  class person_gui_bin defaultNode\n  classDef rootNode fill:#0b6e4f,stroke:#084c38,color:#ffffff,stroke-width:2px\n  classDef targetNode fill:#1d4ed8,stroke:#1e40af,color:#ffffff,stroke-width:2px\n  classDef defaultNode fill:#f5f5f4,stroke:#a8a29e,color:#1c1917,stroke-width:1px\n  %% Dashed edges with ? indicate relation edges that still need user confirmation."
  },
  "user_feedback": {
    "headline": "已完成当前关系网络摘要，剑锋 是最强连接中心之一",
    "summary_lines": [
      "当前共有 3 份人物档案",
      "推断出 2 条关系边",
      "其中 1 条边建议你做人工核实"
    ],
    "key_findings": [
      "当前最强连接中心包括：剑锋 / 雁然"
    ],
    "confidence_notes": [
      "全局网络摘要只基于当前已确认档案，不代表全部真实关系",
      "边数量和中心度会随着新资料导入持续变化"
    ],
    "next_action": {
      "type": "review_network_edges",
      "message": "建议优先核实 1 条关系边，再决定哪些人物真的属于你的桥接网络"
    }
  },
  "notes": ""
}
